{
  "run_id": "exp_20260206_120000",
  "seed_id": "EXP-030",
  "title": "Track x Distance Conditional Jockey/Trainer Win-Rate Encoding",
  "status": "inconclusive",
  "metrics": {
    "roi": -0.32752808988764043,
    "total_stake": 71200.0,
    "n_bets": 172,
    "max_drawdown": 0.12946666666666667,
    "test_period": "2024-01-01 to 2024-12-31",
    "rolling": "no",
    "design_window": "N/A",
    "eval_window": "N/A",
    "paired_delta": "N/A",
    "pooled_vs_step14_mismatch": "no",
    "preferred_roi": "pooled"
  },
  "artifacts": {
    "metrics_json": "data/holdout_runs/exp_20260206_120000/metrics.json",
    "comparison_json": "N/A",
    "report": "data/holdout_runs/exp_20260206_120000/report/backtest.md"
  }
}