{
  "run_id": "exp_20260206_133000",
  "seed_id": "EXP-028",
  "title": "Layoff and freshness features",
  "status": "inconclusive",
  "metrics": {
    "roi": 0.18907849829351536,
    "total_stake": 117200.0,
    "n_bets": 290,
    "max_drawdown": 0.17100610736097718,
    "test_period": "2024-01-01 to 2024-12-31",
    "rolling": "no",
    "design_window": "N/A",
    "eval_window": "N/A",
    "paired_delta": "N/A",
    "pooled_vs_step14_mismatch": "no",
    "preferred_roi": "pooled"
  },
  "artifacts": {
    "metrics_json": "data/holdout_runs/exp_20260206_133000/metrics.json",
    "comparison_json": "data/holdout_runs/exp_20260206_133000/comparison.json",
    "report": "data/holdout_runs/exp_20260206_133000/report/backtest.md"
  }
}