{
  "run_id": "exp_20260206_055907",
  "seed_id": "EXP-016",
  "title": "Blend model probabilities toward market implied to reduce overconfidence",
  "status": "inconclusive",
  "metrics": {
    "roi": 0.28562874251497006,
    "total_stake": 16700.0,
    "n_bets": 45,
    "max_drawdown": 0.024520361841015276,
    "test_period": "2024-01-01 to 2024-12-31",
    "rolling": "no",
    "design_window": "N/A",
    "eval_window": "N/A",
    "paired_delta": "N/A",
    "pooled_vs_step14_mismatch": "no",
    "preferred_roi": "pooled"
  },
  "artifacts": {
    "metrics_json": "data/holdout_runs/exp_20260206_055907/metrics.json",
    "comparison_json": "N/A",
    "report": "data/holdout_runs/exp_20260206_055907/report/backtest.md"
  }
}