{
  "run_id": "exp_20260207_101500",
  "seed_id": "EXP-032",
  "title": "EXP-032: Course-Specific Gate/Draw Bias Feature",
  "status": "inconclusive",
  "metrics": {
    "roi": 0.07587878787878788,
    "total_stake": 82500.0,
    "n_bets": 171,
    "max_drawdown": 0.09191234933053462,
    "test_period": "2024-01-01 to 2024-12-31",
    "rolling": "no",
    "design_window": "N/A",
    "eval_window": "N/A",
    "paired_delta": "N/A",
    "pooled_vs_step14_mismatch": "no",
    "preferred_roi": "pooled"
  },
  "artifacts": {
    "metrics_json": "data/holdout_runs/exp_20260207_101500/metrics.json",
    "comparison_json": "N/A",
    "report": "data/holdout_runs/exp_20260207_101500/report/backtest.md"
  }
}